{
  "device_results": [
    {
      "approximate": false,
      "confidence": 0.7,
      "deltas": {
        "mounting_height": null,
        "orientation": null,
        "position": null
      },
      "device_id": "D-INVIEW-ABSENT",
      "family": "Speaker",
      "identity_confirmed": false,
      "matched_shot_id": null,
      "notes": [
        "expected in view but no matching device observed"
      ],
      "type": "JBL-C6",
      "verdict": "absent"
    },
    {
      "approximate": false,
      "confidence": 0.25,
      "deltas": {
        "mounting_height": null,
        "orientation": null,
        "position": null
      },
      "device_id": "D-GAP-ABSENT",
      "family": "Camera",
      "identity_confirmed": false,
      "matched_shot_id": null,
      "notes": [
        "not within any captured view (coverage gap)"
      ],
      "type": "AXIS-P32",
      "verdict": "absent"
    },
    {
      "approximate": false,
      "confidence": 0.99,
      "deltas": {
        "mounting_height": 0.0,
        "orientation": 30.0,
        "position": 0.0
      },
      "device_id": "D-ORIENT-FLAG",
      "family": "Card Reader",
      "identity_confirmed": false,
      "matched_shot_id": "S1",
      "notes": [
        "orientation 30.0deg > tol 10.0deg"
      ],
      "type": "HID-R10",
      "verdict": "flag"
    },
    {
      "approximate": false,
      "confidence": 0.99,
      "deltas": {
        "mounting_height": 0.0,
        "orientation": 1.0,
        "position": 0.0
      },
      "device_id": "D-DOWN-PASS",
      "family": "Card Reader",
      "identity_confirmed": false,
      "matched_shot_id": "S1",
      "notes": [],
      "type": "HID-R10",
      "verdict": "pass"
    }
  ],
  "engine_version": "0.1.0",
  "generated_at": "2026-06-28T00:00:00Z",
  "project_id": "demo-coverage-04",
  "schema_version": "1.0.0",
  "summary": {
    "absent": 2,
    "flag": 1,
    "pass": 1,
    "total": 4,
    "type_mismatch": 0
  },
  "units": "feet"
}
